{
  "event_id": "c4d5e6f7-a8b9-4c0d-8e1f-2a3b4c5d6e7f",
  "topic": "tenant.data.erased",
  "schema_version": "1.0.0",
  "occurred_at": "2000-01-12T04:30:00Z",
  "tenant_id": "5b1f3d2e-7c4a-4e0b-9a6d-1f2e3d4c5b6a",
  "correlation_id": "c2d3e4f5-a6b7-4c8d-8e9f-0a1b2c3d4e5f",
  "causation_id": "a0b1c2d3-e4f5-4a6b-8c7d-9e0f1a2b3c4d",
  "payload": {
    "service": "profile",
    "deletion_event_id": "a0b1c2d3-e4f5-4a6b-8c7d-9e0f1a2b3c4d",
    "erased_at": "2000-01-12T04:30:00Z",
    "tables": {
      "profile_version": 6,
      "profile_attribute": 14,
      "review_task": 1,
      "profile_node": 3,
      "idempotency_key": 2,
      "outbox_event": 5
    },
    "retained": [
      {
        "table": "outbox_event",
        "reason": "events of the tenant the relay has not published yet, this one among them; the relay sends them and the outbox prune removes them"
      }
    ]
  }
}
