{
  "event_id": "a0b1c2d3-e4f5-4a6b-8c7d-9e0f1a2b3c4d",
  "topic": "rule.superseded",
  "schema_version": "1.0.0",
  "occurred_at": "2026-10-01T02:31:05Z",
  "tenant_id": null,
  "correlation_id": "c2d3e4f5-a6b7-4c8d-8e9f-0a1b2c3d4e5f",
  "causation_id": "d3e4f5a6-b7c8-4d9e-9f0a-1b2c3d4e5f6a",
  "payload": {
    "rule_id": "3d4e5f6a-7b8c-4d9e-8f0a-1b2c3d4e5f6a",
    "rule_version_id": "5f6a7b8c-9d0e-4f1a-8b2c-3d4e5f6a7b8c",
    "superseded_by_rule_version_id": "4e5f6a7b-8c9d-4e0f-9a1b-2c3d4e5f6a7b",
    "effective_from": "2026-11-01"
  }
}
