{
  "event_id": "a0b1c2d3-e4f5-4a6b-8c7d-9e0f1a2b3c4d",
  "topic": "document.parsed",
  "schema_version": "1.0.0",
  "occurred_at": "2026-10-01T02:31:05Z",
  "tenant_id": null,
  "correlation_id": "c2d3e4f5-a6b7-4c8d-8e9f-0a1b2c3d4e5f",
  "causation_id": "d3e4f5a6-b7c8-4d9e-9f0a-1b2c3d4e5f6a",
  "payload": {
    "document_id": "1b2c3d4e-5f6a-4b7c-8d9e-0f1a2b3c4d5e",
    "source_id": "0a1b2c3d-4e5f-4a6b-8c7d-9e0f1a2b3c4d",
    "doc_type": "notification",
    "title": "Seeks to extend the due date for FORM GSTR-3B",
    "language": "en",
    "published_at": "2026-09-15",
    "clause_count": 3,
    "clause_refs": ["p1", "p2", "p3"],
    "parser_version": "0.1.0"
  }
}
