{
  "event_id": "a0b1c2d3-e4f5-4a6b-8c7d-9e0f1a2b3c4d",
  "topic": "rule.candidate.created",
  "schema_version": "1.1.1",
  "occurred_at": "2026-10-01T02:31:05Z",
  "tenant_id": null,
  "correlation_id": "c2d3e4f5-a6b7-4c8d-8e9f-0a1b2c3d4e5f",
  "causation_id": "d3e4f5a6-b7c8-4d9e-9f0a-1b2c3d4e5f6a",
  "payload": {
    "candidate_id": "2c3d4e5f-6a7b-4c8d-9e0f-1a2b3c4d5e6f",
    "document_id": "1b2c3d4e-5f6a-4b7c-8d9e-0f1a2b3c4d5e",
    "regulator": "cbic",
    "model": "deepseek/deepseek-v4-pro-0813",
    "prompt_version": "extraction.rule_candidate@1",
    "confidence": 0.93,
    "citation_count": 3,
    "needs_review": false,
    "source_id": "0a1b2c3d-4e5f-4a6b-8c7d-9e0f1a2b3c4d",
    "source_key": "cbic_notifications",
    "doc_type": "notification",
    "outcome": "extracted",
    "candidate": {
      "title": "Example: the due date of an example return is extended",
      "summary": "An example notification extends the due date of FORM GSTR-3B for an example month for monthly filers.",
      "doc_kind": "notification",
      "change_kind": "extension",
      "effective_from": "2026-04-20",
      "effective_to": null,
      "references": [],
      "applies_to": [
        {
          "attribute": "filing_scheme",
          "operator": "eq",
          "value": "regular_monthly",
          "clause_ref": "en.p3"
        }
      ],
      "obligation": {
        "title": "File FORM GSTR-3B for the example month",
        "steps": ["Furnish the return in FORM GSTR-3B for the example month by the extended date"],
        "evidence_type": "filing_acknowledgement",
        "due_in_days": null,
        "clause_ref": "en.p3"
      },
      "recurrence": null,
      "amounts": [],
      "citations": [
        {
          "clause_ref": "en.p3",
          "quote": "extends the due date for furnishing the return in FORM GSTR-3B"
        },
        {
          "clause_ref": "en.p4",
          "quote": "This notification shall come into effect"
        },
        {
          "clause_ref": "en.p2",
          "quote": "Example notification"
        }
      ],
      "confidence": 0.93
    },
    "issues": [],
    "suggested_rule_key": "gstr3b_monthly",
    "clause_ids": [
      "5a6b7c8d-9e0f-5a1b-8c2d-3e4f5a6b7c8d",
      "6b7c8d9e-0f1a-5b2c-9d3e-4f5a6b7c8d9e",
      "7c8d9e0f-1a2b-5c3d-8e4f-5a6b7c8d9e0f"
    ],
    "ontology_version": "0.2.0"
  }
}
