{
  "event_id": "d5e6f7a8-b9c0-4d1e-9f2a-3b4c5d6e7f8a",
  "topic": "tenant.data.erased",
  "schema_version": "1.0.0",
  "occurred_at": "2000-01-12T04:31:10Z",
  "tenant_id": "5b1f3d2e-7c4a-4e0b-9a6d-1f2e3d4c5b6a",
  "correlation_id": "c2d3e4f5-a6b7-4c8d-8e9f-0a1b2c3d4e5f",
  "causation_id": "a0b1c2d3-e4f5-4a6b-8c7d-9e0f1a2b3c4d",
  "payload": {
    "service": "rulebook",
    "deletion_event_id": "a0b1c2d3-e4f5-4a6b-8c7d-9e0f1a2b3c4d",
    "erased_at": "2000-01-12T04:31:10Z",
    "tables": {},
    "retained": [
      {
        "table": "review_task",
        "reason": "regulatory data of no tenant: review of the rules, holding no tenant reference"
      },
      {
        "table": "rule_candidate",
        "reason": "regulatory data of no tenant: candidates extracted from public documents"
      }
    ]
  }
}
