{
  "event_id": "b1c2d3e4-f5a6-4b7c-9d8e-0f1a2b3c4d5e",
  "topic": "obligation.created",
  "schema_version": "1.0.0",
  "occurred_at": "2026-10-02T09:12:50+05:30",
  "tenant_id": "9d8c7b6a-5f4e-4d3c-8b2a-1a0f9e8d7c6b",
  "correlation_id": "c2d3e4f5-a6b7-4c8d-8e9f-0a1b2c3d4e5f",
  "causation_id": null,
  "payload": {
    "obligation_id": "8c9d0e1f-2a3b-4c4d-9e5f-6a7b8c9d0e1f",
    "business_id": "6a7b8c9d-0e1f-4a2b-9c3d-4e5f6a7b8c9d",
    "rule_version_id": "4e5f6a7b-8c9d-4e0f-9a1b-2c3d4e5f6a7b",
    "decision_id": "7b8c9d0e-1f2a-4b3c-8d4e-5f6a7b8c9d0e",
    "title": "Display the GST registration certificate at the principal place of business",
    "steps": [],
    "due_at": null
  }
}
