{
  "event_id": "7b8c9d0e-1f2a-4b3c-8d4e-5f6a7b8c9d0e",
  "topic": "user.role.changed",
  "schema_version": "1.0.0",
  "occurred_at": "2026-10-12T06:20:00Z",
  "tenant_id": "0a1b2c3d-4e5f-4a6b-8c7d-8e9f0a1b2c3d",
  "correlation_id": "8c9d0e1f-2a3b-4c4d-9e5f-6a7b8c9d0e1f",
  "causation_id": null,
  "payload": {
    "user_id": "9d0e1f2a-3b4c-4d5e-8f6a-7b8c9d0e1f2a",
    "roles": ["ca_staff", "compliance_lead"],
    "previous_roles": ["ca_admin", "compliance_lead"],
    "reason": "roles_changed",
    "changed_by": "2c3d4e5f-6a7b-4c8d-8e9f-0a1b2c3d4e5f",
    "session_version": 3
  }
}
