{
  "event_id": "c3d4e5f6-a7b8-4c9d-8e0f-1a2b3c4d5e6f",
  "topic": "applicability.decided",
  "schema_version": "1.1.0",
  "occurred_at": "2026-10-04T06:40:12Z",
  "tenant_id": "9d8c7b6a-5f4e-4d3c-8b2a-1a0f9e8d7c6b",
  "correlation_id": "d4e5f6a7-b8c9-4d0e-9f1a-2b3c4d5e6f7a",
  "causation_id": null,
  "payload": {
    "decision_id": "8c9d0e1f-2a3b-4c4d-9e5f-6a7b8c9d0e1f",
    "business_id": "6a7b8c9d-0e1f-4a2b-9c3d-4e5f6a7b8c9d",
    "rule_version_id": "4e5f6a7b-8c9d-4e0f-9a1b-2c3d4e5f6a7b",
    "result": "applies",
    "confidence": 1.0,
    "profile_version": 5,
    "decided_at": "2026-10-04T06:40:12Z",
    "needs_review": false,
    "trigger": "review"
  }
}
