{
  "event_id": "3d4e5f6a-7b8c-4d9e-9f0a-1b2c3d4e5f6a",
  "topic": "user.role.changed",
  "schema_version": "1.0.0",
  "occurred_at": "2026-10-08T11:02:45+05:30",
  "tenant_id": "6c7d8e9f-0a1b-4c2d-8e3f-4a5b6c7d8e9f",
  "correlation_id": "5f6a7b8c-9d0e-4f1a-8b2c-3d4e5f6a7b8c",
  "causation_id": null,
  "payload": {
    "user_id": "6a7b8c9d-0e1f-4a2b-9c3d-4e5f6a7b8c9d",
    "roles": ["staff"],
    "previous_roles": [],
    "reason": "invited",
    "changed_by": "8e9f0a1b-2c3d-4e4f-8a5b-6c7d8e9f0a1b",
    "session_version": 0
  }
}
