{
  "event_id": "a0b1c2d3-e4f5-4a6b-8c7d-9e0f1a2b3c4d",
  "topic": "document.discovered",
  "schema_version": "1.0.0",
  "occurred_at": "2026-10-01T02:31:05Z",
  "tenant_id": null,
  "correlation_id": "c2d3e4f5-a6b7-4c8d-8e9f-0a1b2c3d4e5f",
  "causation_id": "d3e4f5a6-b7c8-4d9e-9f0a-1b2c3d4e5f6a",
  "payload": {
    "source_id": "0a1b2c3d-4e5f-4a6b-8c7d-9e0f1a2b3c4d",
    "document_id": "1b2c3d4e-5f6a-4b7c-8d9e-0f1a2b3c4d5e",
    "regulator": "cbic",
    "url": "https://taxinformation.cbic.gov.in/view-pdf/1000000/ENG/Notifications",
    "external_ref": "17/2026-Central Tax",
    "title": "Seeks to extend the due date for FORM GSTR-3B",
    "published_at": "2026-09-15",
    "sha256": "e3b0c44298fc1c149afbf4c8996fb92427ae41e4649b934ca495991b7852b855",
    "media_type": "application/pdf",
    "fetched_at": "2026-09-16T00:02:11+05:30",
    "raw_uri": "s3://cw-dev-raw/cbic/2026/09/17-2026-central-tax.pdf"
  }
}
