{
  "event_id": "b1c2d3e4-f5a6-4b7c-9d8e-0f1a2b3c4d5e",
  "topic": "rule.candidate.created",
  "schema_version": "1.0.0",
  "occurred_at": "2026-10-02T09:12:50+05:30",
  "tenant_id": null,
  "correlation_id": "c2d3e4f5-a6b7-4c8d-8e9f-0a1b2c3d4e5f",
  "causation_id": null,
  "payload": {
    "candidate_id": "2c3d4e5f-6a7b-4c8d-9e0f-1a2b3c4d5e6f",
    "document_id": "1b2c3d4e-5f6a-4b7c-8d9e-0f1a2b3c4d5e",
    "regulator": "cbic",
    "model": "zai/glm-5.3",
    "prompt_version": "extraction.rule_candidate@1",
    "confidence": 0.61,
    "citation_count": 1,
    "needs_review": true
  }
}
