{
  "event_id": "a0b1c2d3-e4f5-4a6b-8c7d-9e0f1a2b3c4d",
  "topic": "tenant.deletion.requested",
  "schema_version": "1.0.1",
  "occurred_at": "2000-01-10T04:30:05Z",
  "tenant_id": "5b1f3d2e-7c4a-4e0b-9a6d-1f2e3d4c5b6a",
  "correlation_id": "c2d3e4f5-a6b7-4c8d-8e9f-0a1b2c3d4e5f",
  "causation_id": "d3e4f5a6-b7c8-4d9e-9f0a-1b2c3d4e5f6a",
  "payload": {
    "requested_by": "0e1f2a3b-4c5d-4e6f-9a7b-8c9d0e1f2a3b",
    "requested_at": "2000-01-10T10:00:00+05:30",
    "deadline_at": "2000-02-09T10:00:00+05:30",
    "retain_audit": true,
    "reason": "closing the business"
  }
}
