{
  "event_id": "b1c2d3e4-f5a6-4b7c-9d8e-0f1a2b3c4d5e",
  "topic": "document.discovered",
  "schema_version": "1.0.0",
  "occurred_at": "2026-10-02T09:12:50+05:30",
  "tenant_id": null,
  "correlation_id": "c2d3e4f5-a6b7-4c8d-8e9f-0a1b2c3d4e5f",
  "causation_id": null,
  "payload": {
    "source_id": "0a1b2c3d-4e5f-4a6b-8c7d-9e0f1a2b3c4d",
    "document_id": "1b2c3d4e-5f6a-4b7c-8d9e-0f1a2b3c4d5e",
    "regulator": "cbic",
    "url": "https://taxinformation.cbic.gov.in/view-pdf/1000001/ENG/Circulars",
    "sha256": "e3b0c44298fc1c149afbf4c8996fb92427ae41e4649b934ca495991b7852b855",
    "media_type": "application/pdf",
    "fetched_at": "2026-09-16T00:04:30+05:30",
    "raw_uri": "s3://cw-dev-raw/cbic/2026/09/1000001.pdf"
  }
}
