{
  "event_id": "b1c2d3e4-f5a6-4b7c-9d8e-0f1a2b3c4d5e",
  "topic": "obligation.created",
  "schema_version": "1.0.0",
  "occurred_at": "2026-10-02T09:12:50+05:30",
  "tenant_id": "5b1f3d2e-7c4a-4e0b-9a6d-1f2e3d4c5b6a",
  "correlation_id": "c2d3e4f5-a6b7-4c8d-8e9f-0a1b2c3d4e5f",
  "causation_id": "d3e4f5a6-b7c8-4d9e-9f0a-1b2c3d4e5f6a",
  "payload": {}
}
